{
  "$schema": "https://json-schema.org/draft/2020-12/schema",
  "type": "object",
  "properties": {
    "protocolVersion": {
      "type": "number",
      "const": 1
    },
    "id": {
      "type": "string",
      "maxLength": 80,
      "pattern": "^[a-z][a-z0-9-]*$"
    },
    "templateVersion": {
      "type": "string",
      "pattern": "^[1-9]\\d*\\.\\d+\\.\\d+$",
      "description": "模板内容版本，与协议版本分开维护"
    },
    "title": {
      "type": "string",
      "minLength": 1,
      "maxLength": 500
    },
    "description": {
      "type": "string",
      "minLength": 1,
      "maxLength": 2000
    },
    "examples": {
      "minItems": 1,
      "maxItems": 8,
      "type": "array",
      "items": {
        "type": "object",
        "properties": {
          "ref": {
            "type": "string",
            "minLength": 1,
            "maxLength": 500
          },
          "title": {
            "type": "string",
            "minLength": 1,
            "maxLength": 500
          },
          "kind": {
            "type": "string",
            "enum": [
              "image",
              "video"
            ]
          }
        },
        "required": [
          "ref",
          "title",
          "kind"
        ],
        "additionalProperties": false
      },
      "description": "左侧案例引用；离线不验证资源存在性"
    },
    "fields": {
      "minItems": 1,
      "maxItems": 64,
      "type": "array",
      "items": {
        "oneOf": [
          {
            "type": "object",
            "properties": {
              "id": {
                "type": "string",
                "maxLength": 64,
                "pattern": "^[a-z][a-z0-9_]*$",
                "description": "字段标识；字母开头，仅小写字母、数字和下划线"
              },
              "label": {
                "type": "string",
                "minLength": 1,
                "maxLength": 500
              },
              "description": {
                "type": "string",
                "maxLength": 2000
              },
              "required": {
                "default": false,
                "type": "boolean"
              },
              "type": {
                "type": "string",
                "const": "text"
              },
              "minLength": {
                "type": "integer",
                "minimum": 0,
                "maximum": 9007199254740991
              },
              "maxLength": {
                "type": "integer",
                "exclusiveMinimum": 0,
                "maximum": 9007199254740991
              },
              "default": {
                "type": "string"
              }
            },
            "required": [
              "id",
              "label",
              "type"
            ],
            "additionalProperties": false,
            "description": "单行文本；不接受换行符"
          },
          {
            "type": "object",
            "properties": {
              "id": {
                "type": "string",
                "maxLength": 64,
                "pattern": "^[a-z][a-z0-9_]*$",
                "description": "字段标识；字母开头，仅小写字母、数字和下划线"
              },
              "label": {
                "type": "string",
                "minLength": 1,
                "maxLength": 500
              },
              "description": {
                "type": "string",
                "maxLength": 2000
              },
              "required": {
                "default": false,
                "type": "boolean"
              },
              "type": {
                "type": "string",
                "const": "textarea"
              },
              "minLength": {
                "type": "integer",
                "minimum": 0,
                "maximum": 9007199254740991
              },
              "maxLength": {
                "type": "integer",
                "exclusiveMinimum": 0,
                "maximum": 9007199254740991
              },
              "default": {
                "type": "string"
              }
            },
            "required": [
              "id",
              "label",
              "type"
            ],
            "additionalProperties": false,
            "description": "多行文本；原样保留换行及特殊字符"
          },
          {
            "type": "object",
            "properties": {
              "id": {
                "type": "string",
                "maxLength": 64,
                "pattern": "^[a-z][a-z0-9_]*$",
                "description": "字段标识；字母开头，仅小写字母、数字和下划线"
              },
              "label": {
                "type": "string",
                "minLength": 1,
                "maxLength": 500
              },
              "description": {
                "type": "string",
                "maxLength": 2000
              },
              "required": {
                "default": false,
                "type": "boolean"
              },
              "type": {
                "type": "string",
                "const": "file"
              },
              "accept": {
                "minItems": 1,
                "type": "array",
                "items": {
                  "type": "string",
                  "pattern": "^[a-z0-9][a-z0-9!#$&^_.+-]*\\/(?:[a-z0-9][a-z0-9!#$&^_.+-]*|\\*)$"
                }
              },
              "maxFiles": {
                "type": "integer",
                "exclusiveMinimum": 0,
                "maximum": 20
              },
              "maxBytes": {
                "type": "integer",
                "exclusiveMinimum": 0,
                "maximum": 9007199254740991
              }
            },
            "required": [
              "id",
              "label",
              "type",
              "accept",
              "maxFiles",
              "maxBytes"
            ],
            "additionalProperties": false,
            "description": "文件元数据及不透明素材引用；不执行上传或探测资源"
          },
          {
            "type": "object",
            "properties": {
              "id": {
                "type": "string",
                "maxLength": 64,
                "pattern": "^[a-z][a-z0-9_]*$",
                "description": "字段标识；字母开头，仅小写字母、数字和下划线"
              },
              "label": {
                "type": "string",
                "minLength": 1,
                "maxLength": 500
              },
              "description": {
                "type": "string",
                "maxLength": 2000
              },
              "required": {
                "default": false,
                "type": "boolean"
              },
              "type": {
                "type": "string",
                "const": "number"
              },
              "min": {
                "type": "number"
              },
              "max": {
                "type": "number"
              },
              "step": {
                "default": 1,
                "type": "number",
                "exclusiveMinimum": 0
              },
              "default": {
                "type": "number"
              }
            },
            "required": [
              "id",
              "label",
              "type",
              "min",
              "max"
            ],
            "additionalProperties": false,
            "description": "数字步进；范围及相对 min 的 step 必须满足"
          },
          {
            "type": "object",
            "properties": {
              "id": {
                "type": "string",
                "maxLength": 64,
                "pattern": "^[a-z][a-z0-9_]*$",
                "description": "字段标识；字母开头，仅小写字母、数字和下划线"
              },
              "label": {
                "type": "string",
                "minLength": 1,
                "maxLength": 500
              },
              "description": {
                "type": "string",
                "maxLength": 2000
              },
              "required": {
                "default": false,
                "type": "boolean"
              },
              "type": {
                "type": "string",
                "const": "slider"
              },
              "min": {
                "type": "number"
              },
              "max": {
                "type": "number"
              },
              "step": {
                "default": 1,
                "type": "number",
                "exclusiveMinimum": 0
              },
              "default": {
                "type": "number"
              }
            },
            "required": [
              "id",
              "label",
              "type",
              "min",
              "max"
            ],
            "additionalProperties": false,
            "description": "滑块；规则与数字步进一致"
          },
          {
            "type": "object",
            "properties": {
              "id": {
                "type": "string",
                "maxLength": 64,
                "pattern": "^[a-z][a-z0-9_]*$",
                "description": "字段标识；字母开头，仅小写字母、数字和下划线"
              },
              "label": {
                "type": "string",
                "minLength": 1,
                "maxLength": 500
              },
              "description": {
                "type": "string",
                "maxLength": 2000
              },
              "required": {
                "default": false,
                "type": "boolean"
              },
              "type": {
                "type": "string",
                "const": "select"
              },
              "options": {
                "minItems": 1,
                "maxItems": 32,
                "type": "array",
                "items": {
                  "type": "object",
                  "properties": {
                    "value": {
                      "type": "string",
                      "minLength": 1,
                      "maxLength": 500
                    },
                    "label": {
                      "type": "string",
                      "minLength": 1,
                      "maxLength": 500
                    }
                  },
                  "required": [
                    "value",
                    "label"
                  ],
                  "additionalProperties": false
                }
              },
              "default": {
                "type": "string"
              }
            },
            "required": [
              "id",
              "label",
              "type",
              "options"
            ],
            "additionalProperties": false,
            "description": "单选卡片；输出选项的 value，label 仅用于显示"
          },
          {
            "type": "object",
            "properties": {
              "id": {
                "type": "string",
                "maxLength": 64,
                "pattern": "^[a-z][a-z0-9_]*$",
                "description": "字段标识；字母开头，仅小写字母、数字和下划线"
              },
              "label": {
                "type": "string",
                "minLength": 1,
                "maxLength": 500
              },
              "description": {
                "type": "string",
                "maxLength": 2000
              },
              "required": {
                "default": false,
                "type": "boolean"
              },
              "type": {
                "type": "string",
                "const": "aspect-ratio"
              },
              "options": {
                "minItems": 1,
                "maxItems": 32,
                "type": "array",
                "items": {
                  "type": "object",
                  "properties": {
                    "value": {
                      "type": "string",
                      "pattern": "^[1-9]\\d{0,3}:[1-9]\\d{0,3}$"
                    },
                    "label": {
                      "type": "string",
                      "minLength": 1,
                      "maxLength": 500
                    }
                  },
                  "required": [
                    "value",
                    "label"
                  ],
                  "additionalProperties": false
                }
              },
              "default": {
                "type": "string"
              }
            },
            "required": [
              "id",
              "label",
              "type",
              "options"
            ],
            "additionalProperties": false,
            "description": "比例选择；配置正整数宽高比选项，不是媒体容器"
          }
        ]
      }
    },
    "prompt": {
      "type": "string",
      "minLength": 1,
      "maxLength": 20000,
      "description": "固定文字与 {{field_id}} 占位符；替换一次，不执行表达式"
    },
    "attachments": {
      "default": [],
      "description": "文件字段标识；按此顺序输出独立素材引用",
      "type": "array",
      "items": {
        "type": "string",
        "maxLength": 64,
        "pattern": "^[a-z][a-z0-9_]*$",
        "description": "字段标识；字母开头，仅小写字母、数字和下划线"
      }
    }
  },
  "required": [
    "protocolVersion",
    "id",
    "templateVersion",
    "title",
    "description",
    "examples",
    "fields",
    "prompt"
  ],
  "additionalProperties": false
}
